{
  "$schema": "http://json-schema.org/draft-07/schema",
  "title": "Launch Parameters",
  "description": "Configuration for a test run.",
  "additionalProperties": false,
  "properties": {
    "tests": {
      "$ref": "testArray.schema.json"
    },
    "coordinates": {
      "type": "array",
      "items": {
        "type": "integer",
        "minimum": 0,
        "maximum": 100
      }
    },
    "run": {
      "type": "string"
    },
    "started": {
      "$ref": "time.schema.json"
    }
  },
  "type": "object"
}